{
 "name": "pickerhost.exe",
 "builds": [
  {
   "sha256": "52e6c93d41bc8357da9098b26848fe9103491c81d3cfa701e86a4751ac9e885d",
   "machine": "x64",
   "has_version_resource": true,
   "original_filename": "PickerHost.exe",
   "internal_name": "PickerHost",
   "file_description": "File Picker UI Host",
   "company_name": "Microsoft Corporation",
   "product_name": "Microsoft® Windows® Operating System",
   "file_version": "10.0.26100.9549 (WinBuild.160101.0800)",
   "fixed_file_version": "10.0.26100.9549",
   "has_embedded_signature": true,
   "is_dotnet": false,
   "scan_label": "host 10.0.26300",
   "observed_path": "C:\\Windows\\System32\\PickerHost.exe",
   "sources": [
    "local"
   ]
  },
  {
   "sha256": "02f3f7b3da2351e4c655e16ace8c87c7f150ed1d9ef7244a558ff4beaedc88ea",
   "machine": "x86",
   "has_version_resource": true,
   "original_filename": "PickerHost.exe",
   "internal_name": "PickerHost",
   "file_description": "File Picker UI Host",
   "company_name": "Microsoft Corporation",
   "product_name": "Microsoft® Windows® Operating System",
   "file_version": "10.0.26100.9549 (WinBuild.160101.0800)",
   "fixed_file_version": "10.0.26100.9549",
   "has_embedded_signature": true,
   "is_dotnet": false,
   "scan_label": "host 10.0.26300",
   "observed_path": "C:\\Windows\\SysWOW64\\PickerHost.exe",
   "sources": [
    "local"
   ]
  }
 ],
 "schema_version": 1,
 "updated": "2026-10-26",
 "original_filenames": [
  {
   "value": "PickerHost.exe",
   "builds": 2,
   "machines": [
    "x64",
    "x86"
   ],
   "sources": [
    "local"
   ],
   "windows_versions": [],
   "min_version": "10.0.26100.9549",
   "max_version": "10.0.26100.9549",
   "first_seen": null,
   "last_seen": null,
   "provenance": "parsed"
  }
 ]
}
