{
 "name": "healthattestationclientagent.exe",
 "builds": [
  {
   "sha256": "721e72b837940730610ad64cca4d2ab35ad2b3e5cd38a583cce2b16b339af47d",
   "machine": "x64",
   "has_version_resource": true,
   "original_filename": "HealthAttestationClientAgent.exe",
   "internal_name": "HealthAttestationClientAgent",
   "file_description": "Microsoft (R) Health Attestation Client Agent",
   "company_name": "Microsoft Corporation",
   "product_name": "Microsoft® Windows® Operating System",
   "file_version": "10.0.26100.9549 (WinBuild.160101.0800)",
   "fixed_file_version": "10.0.26100.9549",
   "has_embedded_signature": false,
   "is_dotnet": false,
   "scan_label": "host 10.0.26300",
   "observed_path": "C:\\Windows\\System32\\HealthAttestationClient\\HealthAttestationClientAgent.exe",
   "sources": [
    "local"
   ]
  }
 ],
 "schema_version": 1,
 "updated": "2026-10-26",
 "original_filenames": [
  {
   "value": "HealthAttestationClientAgent.exe",
   "builds": 1,
   "machines": [
    "x64"
   ],
   "sources": [
    "local"
   ],
   "windows_versions": [],
   "min_version": "10.0.26100.9549",
   "max_version": "10.0.26100.9549",
   "first_seen": null,
   "last_seen": null,
   "provenance": "parsed"
  }
 ]
}
