{
 "name": "ctacworker.exe",
 "builds": [
  {
   "sha256": "39b65a94b8f9124f50078ef0f5081d63bc95828b738339f2ada8131e773c5648",
   "machine": "x64",
   "has_version_resource": false,
   "original_filename": null,
   "internal_name": null,
   "file_description": null,
   "company_name": null,
   "product_name": null,
   "file_version": null,
   "fixed_file_version": null,
   "has_embedded_signature": false,
   "is_dotnet": false,
   "scan_label": "host 10.0.26300",
   "observed_path": "C:\\Windows\\System32\\CtacWorker.exe",
   "sources": [
    "local"
   ]
  }
 ],
 "schema_version": 1,
 "updated": "2026-10-26",
 "original_filenames": [
  {
   "value": null,
   "builds": 1,
   "machines": [
    "x64"
   ],
   "sources": [
    "local"
   ],
   "windows_versions": [],
   "min_version": null,
   "max_version": null,
   "first_seen": null,
   "last_seen": null,
   "provenance": "parsed"
  }
 ]
}
