{
 "name": "helppane.exe",
 "builds": [
  {
   "sha256": "ed7e10d893f4c01f86e844a41ba413217e9db94473724938e71fa688cca0659f",
   "machine": "x64",
   "has_version_resource": true,
   "original_filename": "HelpPane.exe",
   "internal_name": "HelpPane.exe",
   "file_description": "Microsoft Help and Support",
   "company_name": "Microsoft Corporation",
   "product_name": "Microsoft® Windows® Operating System",
   "file_version": "10.0.26100.9549 (WinBuild.160101.0800)",
   "fixed_file_version": "10.0.26100.9549",
   "has_embedded_signature": false,
   "is_dotnet": false,
   "scan_label": "host 10.0.26300",
   "observed_path": "C:\\Windows\\HelpPane.exe",
   "sources": [
    "local"
   ]
  }
 ],
 "schema_version": 1,
 "updated": "2026-10-26",
 "original_filenames": [
  {
   "value": "HelpPane.exe",
   "builds": 1,
   "machines": [
    "x64"
   ],
   "sources": [
    "local"
   ],
   "windows_versions": [],
   "min_version": "10.0.26100.9549",
   "max_version": "10.0.26100.9549",
   "first_seen": null,
   "last_seen": null,
   "provenance": "parsed"
  }
 ]
}
