{
 "name": "wmpdmc.exe",
 "builds": [
  {
   "sha256": "04c23776c6e2ae916e692ef033570aca8d2def8d17610f92cb1c9f4fdab9f328",
   "machine": "x64",
   "has_version_resource": true,
   "original_filename": "WMPDMC.exe",
   "internal_name": "WMPDMC",
   "file_description": "Cast to Device",
   "company_name": "Microsoft Corporation",
   "product_name": "Microsoft® Windows® Operating System",
   "file_version": "10.0.26100.9278 (WinBuild.160101.0800)",
   "fixed_file_version": "10.0.26100.9278",
   "has_embedded_signature": false,
   "is_dotnet": false,
   "scan_label": "host 10.0.26300",
   "observed_path": "C:\\Windows\\System32\\WMPDMC.exe",
   "sources": [
    "local"
   ]
  }
 ],
 "schema_version": 1,
 "updated": "2026-10-26",
 "original_filenames": [
  {
   "value": "WMPDMC.exe",
   "builds": 1,
   "machines": [
    "x64"
   ],
   "sources": [
    "local"
   ],
   "windows_versions": [],
   "min_version": "10.0.26100.9278",
   "max_version": "10.0.26100.9278",
   "first_seen": null,
   "last_seen": null,
   "provenance": "parsed"
  }
 ]
}
