{
 "name": "regjump.exe",
 "builds": [
  {
   "sha256": "d9b8b767e7dd8253d4eb6883ed168f0c6ac89a7ea589a67d9fad1d04fb9acbab",
   "machine": "x86",
   "has_version_resource": true,
   "original_filename": "regjump.exe",
   "internal_name": "regjump",
   "file_description": "Jumps in Regedit",
   "company_name": "Sysinternals - www.sysinternals.com",
   "product_name": "Sysinternals Regjump",
   "file_version": "1.11",
   "fixed_file_version": "1.11.0.0",
   "has_embedded_signature": true,
   "is_dotnet": false,
   "vendor": "Microsoft (Sysinternals)",
   "product": "Sysinternals Regjump",
   "release": "2021-10-12",
   "last_seen": "2021-10-12",
   "download_url": "https://live.sysinternals.com/regjump.exe",
   "sources": [
    "sysinternals"
   ]
  }
 ],
 "schema_version": 1,
 "updated": "2026-10-26",
 "original_filenames": [
  {
   "value": "regjump.exe",
   "builds": 1,
   "machines": [
    "x86"
   ],
   "sources": [
    "sysinternals"
   ],
   "windows_versions": [],
   "min_version": "1.11.0.0",
   "max_version": "1.11.0.0",
   "first_seen": "2021-10-12",
   "last_seen": "2021-10-12",
   "provenance": "parsed"
  }
 ]
}
