{
 "name": "xbootmgr.exe",
 "builds": [
  {
   "sha256": "3ec0a627146ba16753fb5b9f422d3739948c37e6419725f08680990e4373346c",
   "machine": "x64",
   "has_version_resource": true,
   "original_filename": "xbootmgr.exe",
   "internal_name": "xbootmgr.exe",
   "file_description": "Performance Analyzer Power Transition Performance Testing Utility",
   "company_name": "Microsoft Corporation",
   "product_name": "Microsoft® Windows® Performance Analyzer",
   "file_version": "10.0.14393.9611 (rs1_release.261009-0224)",
   "fixed_file_version": "10.0.14393.9611",
   "has_embedded_signature": false,
   "is_dotnet": false,
   "windows_versions": [
    "1607"
   ],
   "first_seen": "2026-10-13",
   "last_seen": "2026-10-13",
   "os_builds": [
    "14393.9612"
   ],
   "signing_status": "Unsigned",
   "download_url": "https://msdl.microsoft.com/download/symbols/xbootmgr.exe/6AC8D69521000/xbootmgr.exe",
   "sources": [
    "winbindex"
   ]
  },
  {
   "sha256": "04daa1fd917717e2584350817eb8cc90ab6ee57f9ef2b88800b4a94fa7a136e9",
   "machine": "x64",
   "has_version_resource": true,
   "original_filename": "xbootmgr.exe",
   "internal_name": "xbootmgr.exe",
   "file_description": "Performance Analyzer Power Transition Performance Testing Utility",
   "company_name": "Microsoft Corporation",
   "product_name": "Microsoft® Windows® Performance Analyzer",
   "file_version": "10.0.10240.20747 (th1.240801-2004)",
   "fixed_file_version": "10.0.10240.20747",
   "has_embedded_signature": false,
   "is_dotnet": false,
   "windows_versions": [
    "1507"
   ],
   "first_seen": "2024-08-13",
   "last_seen": "2025-10-14",
   "os_builds": [
    "10240.20751",
    "10240.20766",
    "10240.20796",
    "10240.20826",
    "10240.20857",
    "10240.20890",
    "10240.20915",
    "10240.20947",
    "10240.20979",
    "10240.21014",
    "10240.21034",
    "10240.21073",
    "10240.21100",
    "10240.21128",
    "10240.21161"
   ],
   "signing_status": "Unsigned",
   "download_url": "https://msdl.microsoft.com/download/symbols/xbootmgr.exe/66AC98D121000/xbootmgr.exe",
   "sources": [
    "winbindex"
   ]
  },
  {
   "sha256": "f7e415458b70d36e0d07d3e32a6e3e9ead4cb3e251d604a5fe1e1e209e73a2ff",
   "machine": "x64",
   "has_version_resource": true,
   "original_filename": "xbootmgr.exe",
   "internal_name": "xbootmgr.exe",
   "file_description": "Performance Analyzer Power Transition Performance Testing Utility",
   "company_name": "Microsoft Corporation",
   "product_name": "Microsoft® Windows® Performance Analyzer",
   "file_version": "10.0.15063.0 (WinBuild.160101.0800)",
   "fixed_file_version": "10.0.15063.0",
   "has_embedded_signature": false,
   "is_dotnet": false,
   "windows_versions": [
    "1703"
   ],
   "first_seen": "2018-03-22",
   "last_seen": "2021-03-09",
   "os_builds": [
    "15063.1155",
    "15063.1182",
    "15063.1209",
    "15063.1235",
    "15063.1292",
    "15063.1358",
    "15063.1387",
    "15063.1418",
    "15063.1446",
    "15063.1478",
    "15063.1506",
    "15063.1508",
    "15063.1563",
    "15063.1596",
    "15063.1631",
    "15063.1659",
    "15063.1689",
    "15063.1716",
    "15063.1746",
    "15063.1784",
    "15063.1785",
    "15063.1805",
    "15063.1808",
    "15063.1839",
    "15063.1868",
    "15063.1897",
    "15063.1898",
    "15063.1928",
    "15063.1955",
    "15063.1988",
    "15063.2021",
    "15063.2045",
    "15063.2046",
    "15063.2078",
    "15063.2079",
    "15063.2108",
    "15063.2172",
    "15063.2224",
    "15063.2254",
    "15063.2284",
    "15063.2313",
    "15063.2346",
    "15063.2375",
    "15063.2409",
    "15063.2411",
    "15063.2439",
    "15063.2467",
    "15063.2500",
    "15063.2525",
    "15063.2554",
    "15063.2584",
    "15063.2614",
    "15063.2642",
    "15063.2679",
    "15063.994"
   ],
   "signing_status": "Unsigned",
   "download_url": "https://msdl.microsoft.com/download/symbols/xbootmgr.exe/02B0E38D20000/xbootmgr.exe",
   "sources": [
    "winbindex"
   ]
  },
  {
   "sha256": "08209eac028a0731c3a51e1c3dda31647ea5119a6b379126195c6937c2b36130",
   "machine": "x64",
   "has_version_resource": true,
   "original_filename": "xbootmgr.exe",
   "internal_name": "xbootmgr.exe",
   "file_description": "Performance Analyzer Power Transition Performance Testing Utility",
   "company_name": "Microsoft Corporation",
   "product_name": "Microsoft® Windows® Performance Analyzer",
   "file_version": "10.0.10586.0 (th2_release.151029-1700)",
   "fixed_file_version": "10.0.10586.0",
   "has_embedded_signature": false,
   "is_dotnet": false,
   "windows_versions": [
    "1511"
   ],
   "first_seen": "2016-07-12",
   "last_seen": "2018-04-10",
   "os_builds": [
    "10586.1007",
    "10586.1045",
    "10586.1106",
    "10586.1176",
    "10586.1177",
    "10586.1232",
    "10586.1295",
    "10586.1356",
    "10586.1358",
    "10586.1417",
    "10586.1478",
    "10586.1540",
    "10586.494",
    "10586.545",
    "10586.589",
    "10586.633",
    "10586.679",
    "10586.713",
    "10586.753",
    "10586.839",
    "10586.842",
    "10586.873",
    "10586.916",
    "10586.962",
    "10586.965"
   ],
   "signing_status": "Unsigned",
   "download_url": "https://msdl.microsoft.com/download/symbols/xbootmgr.exe/5632D77621000/xbootmgr.exe",
   "sources": [
    "winbindex"
   ]
  }
 ],
 "schema_version": 1,
 "updated": "2026-10-26",
 "original_filenames": [
  {
   "value": "xbootmgr.exe",
   "builds": 4,
   "machines": [
    "x64"
   ],
   "sources": [
    "winbindex"
   ],
   "windows_versions": [
    "1507",
    "1511",
    "1607",
    "1703"
   ],
   "min_version": "10.0.10240.20747",
   "max_version": "10.0.15063.0",
   "first_seen": "2016-07-12",
   "last_seen": "2026-10-13",
   "provenance": "parsed"
  }
 ],
 "gaps": []
}
