{
 "name": "refsutil.exe",
 "builds": [
  {
   "sha256": "889069f4aeb6cacd526b6e22bfe6a5d506fb5f9de4d708ae1219b0b5c2dffb1d",
   "machine": "x64",
   "has_version_resource": true,
   "original_filename": "refsutil.exe",
   "internal_name": "refsutil.exe",
   "file_description": "refsutil.exe",
   "company_name": "Microsoft Corporation",
   "product_name": "Microsoft® Windows® Operating System",
   "file_version": "10.0.26100.9711 (WinBuild.160101.0800)",
   "fixed_file_version": "10.0.26100.9711",
   "has_embedded_signature": false,
   "is_dotnet": false,
   "scan_label": "host 10.0.26300",
   "observed_path": "C:\\Windows\\System32\\refsutil.exe",
   "sources": [
    "local"
   ]
  }
 ],
 "schema_version": 1,
 "updated": "2026-10-26",
 "original_filenames": [
  {
   "value": "refsutil.exe",
   "builds": 1,
   "machines": [
    "x64"
   ],
   "sources": [
    "local"
   ],
   "windows_versions": [],
   "min_version": "10.0.26100.9711",
   "max_version": "10.0.26100.9711",
   "first_seen": null,
   "last_seen": null,
   "provenance": "parsed"
  }
 ]
}
